{
  "schema_version": "1.0",
  "sample_id": "009__a8c290fcfce8",
  "run_id": "mvtec/bottle/good",
  "created_at": "2026-03-09T05:18:40Z",
  "paths": {
    "original": "original.png",
    "heatmap": "heatmap.png",
    "overlay": "overlay.png",
    "result": "result.json",
    "gt_mask": null,
    "anomaly_map_npy": "anomaly_map.npy",
    "debug_dir": null
  },
  "prediction": {
    "label": "anomaly",
    "score": 0.4278223216533661,
    "threshold": 0.37197692513465885,
    "probability": null,
    "score_method": "anomaly_map_quantile",
    "score_quantile": 0.995,
    "task": "image",
    "model": {
      "name": "patchcore",
      "version": "2.1.0",
      "framework": "anomalib"
    },
    "risk_est": 1.0
  },
  "explainability": {
    "heatmap_stats": {
      "min": 0.0,
      "max": 0.9999986290931702,
      "mean": 0.12181448936462402,
      "p95": 0.46090516448020935
    },
    "hotspots": [
      {
        "bbox_xyxy": [
          132,
          45,
          191,
          100
        ],
        "score": 0.8500657081604004
      }
    ],
    "notes": "robust_norm(p_lo=50.0,p_hi=99.5), blur_sigma=2.0, dual_th(th_high=0.85,th_low=0.65), min_area=80, top_k=5"
  },
  "reliability": {
    "confidence": 0.5918840473890303,
    "signals": {
      "score_margin": 0.055845396518707235,
      "heatmap_concentration": 1.0,
      "area_ratio": 0.0298309326171875,
      "max_intensity": 0.9999986290931702,
      "mean_intensity": 0.12181448936462402
    },
    "notes": "reliability looks stable"
  },
  "rag": {
    "context_used": false,
    "contexts": [],
    "notes": ""
  },
  "llm": {
    "summary": "",
    "explanation": "",
    "notes": "skipped_non_uncertain"
  },
  "evaluation": {
    "has_gt": false,
    "gt_label": "good",
    "error_type": null
  },
  "triage": {
    "base_label": "anomaly",
    "final_label": "anomaly",
    "reasons": []
  },
  "meta": {
    "input_filename": "009.png",
    "input_sha1": "a8c290fcfce80091a6c580072a912fd0a51fb33c",
    "image_size_wh": [
      900,
      900
    ],
    "tags": [],
    "debug": {
      "raw_score_debug": 0.425937294960022,
      "decision_score_q": 0.995
    },
    "defect_type": "good"
  }
}